concert_num,location,date,lover_bodysuit,lover_jacket,lover_guitar,fearless_dress,evermore,red_tshirt,red_guitar,speaknow,koi,reputation,folklore,1989_1,1989_2,ttpd_dress,ttpd_twopiece,ttpd_coverall,surprise_song,midnights_shirt,midnights_bodysuit,midnights_karmajacket,date_str,date_weekday,location_city,location_state_region,location_country,tour_leg,night_num,night_count,location_night,lover_bodysuit_n_since_last,lover_jacket_n_since_last,lover_guitar_n_since_last,fearless_dress_n_since_last,evermore_n_since_last,red_tshirt_n_since_last,red_guitar_n_since_last,speaknow_n_since_last,koi_n_since_last,reputation_n_since_last,folklore_n_since_last,1989_1_n_since_last,1989_2_n_since_last,ttpd_dress_n_since_last,ttpd_twopiece_n_since_last,ttpd_coverall_n_since_last,surprise_song_n_since_last,midnights_shirt_n_since_last,midnights_bodysuit_n_since_last,midnights_karmajacket_n_since_last
73,"Melbourne, Australia",2024-02-18,Barbie Pink,Pink,Pink,Gold Noodle,Orange,WHO'S TAYLOR SWIFT ANYWAY? EW.,Black,Blue Ball Gown,Yes,Red and Black,Purple,Old Blue,,0,0,0,Blue,Silver Sequin,Cutouts,Magenta,"Sunday, February 18, 2024",Sunday,Melbourne,,Australia,Asia-Pacific,3,3,"Melbourne, Australia<br>Night 3",&#x2022; Shows since last worn: 3<br>&#x2022; Days since last worn: 8<br><br>&#x2022; Prior number of times worn: 4<br>&#x2022; Prior number of times worn on a Night 3: 1<br>&#x2022; Prior number of times worn on a Sunday: 1<br><br>&#x2022; Last worn on a Night 4<br>&#x2022; Last worn on a Saturday,&#x2022; Shows since last worn: 3<br>&#x2022; Days since last worn: 8<br><br>&#x2022; Prior number of times worn: 4<br>&#x2022; Prior number of times worn on a Night 3: 1<br>&#x2022; Prior number of times worn on a Sunday: 1<br><br>&#x2022; Last worn on a Night 4<br>&#x2022; Last worn on a Saturday,&#x2022; Shows since last worn: 2<br>&#x2022; Days since last worn: 2<br><br>&#x2022; Prior number of times worn: 29<br>&#x2022; Prior number of times worn on a Night 3: 2<br>&#x2022; Prior number of times worn on a Sunday: 3<br><br>&#x2022; Last worn on a Night 1<br>&#x2022; Last worn on a Friday,&#x2022; Shows since last worn: 4<br>&#x2022; Days since last worn: 9<br><br>&#x2022; Prior number of times worn: 18<br>&#x2022; Prior number of times worn on a Night 3: 6<br>&#x2022; Prior number of times worn on a Sunday: 3<br><br>&#x2022; Last worn on a Night 3<br>&#x2022; Last worn on a Friday,&#x2022; Shows since last worn: 2<br>&#x2022; Days since last worn: 2<br><br>&#x2022; Prior number of times worn: 62<br>&#x2022; Prior number of times worn on a Night 3: 13<br>&#x2022; Prior number of times worn on a Sunday: 10<br><br>&#x2022; Last worn on a Night 1<br>&#x2022; Last worn on a Friday,&#x2022; Shows since last worn: 6<br>&#x2022; Days since last worn: 11<br><br>&#x2022; Prior number of times worn: 25<br>&#x2022; Prior number of times worn on a Night 3: 4<br>&#x2022; Prior number of times worn on a Sunday: 3<br><br>&#x2022; Last worn on a Night 1<br>&#x2022; Last worn on a Wednesday,&#x2022; Wore at previous show<br>&#x2022; Wore day before<br><br>&#x2022; Prior number of times worn: 67<br>&#x2022; Prior number of times worn on a Night 3: 15<br>&#x2022; Prior number of times worn on a Sunday: 13<br><br>&#x2022; Last worn on a Night 2<br>&#x2022; Last worn on a Saturday,&#x2022; Shows since last worn: 3<br>&#x2022; Days since last worn: 8<br><br>&#x2022; Prior number of times worn: 5<br>&#x2022; Prior number of times worn on a Night 3: 1<br>&#x2022; Prior number of times worn on a Sunday: 1<br><br>&#x2022; Last worn on a Night 4<br>&#x2022; Last worn on a Saturday,&#x2022; Wore at previous show<br>&#x2022; Wore day before<br><br>&#x2022; Prior number of times worn: 33<br>&#x2022; Prior number of times worn on a Night 3: 6<br>&#x2022; Prior number of times worn on a Sunday: 5<br><br>&#x2022; Last worn on a Night 2<br>&#x2022; Last worn on a Saturday,&#x2022; Wore at previous show<br>&#x2022; Wore day before<br><br>&#x2022; Prior number of times worn: 72<br>&#x2022; Prior number of times worn on a Night 3: 15<br>&#x2022; Prior number of times worn on a Sunday: 13<br><br>&#x2022; Last worn on a Night 2<br>&#x2022; Last worn on a Saturday,&#x2022; Shows since last worn: 9<br>&#x2022; Days since last worn: 86<br><br>&#x2022; Prior number of times worn: 12<br>&#x2022; Prior number of times worn on a Night 3: 3<br>&#x2022; Prior number of times worn on a Sunday: 3<br><br>&#x2022; Last worn on a Night 1<br>&#x2022; Last worn on a Friday,&#x2022; Shows since last worn: 6<br>&#x2022; Days since last worn: 11<br><br>&#x2022; Prior number of times worn: 6<br>&#x2022; First time worn on a Night 3<br>&#x2022; Prior number of times worn on a Sunday: 1<br><br>&#x2022; Last worn on a Night 1<br>&#x2022; Last worn on a Wednesday,&#x2022; Wore at previous show<br>&#x2022; Wore day before<br><br>&#x2022; Prior number of times worn: 72<br>&#x2022; Prior number of times worn on a Night 3: 15<br>&#x2022; Prior number of times worn on a Sunday: 13<br><br>&#x2022; Last worn on a Night 2<br>&#x2022; Last worn on a Saturday,&#x2022; Wore at previous show<br>&#x2022; Wore day before<br><br>&#x2022; Prior number of times worn: 72<br>&#x2022; Prior number of times worn on a Night 3: 15<br>&#x2022; Prior number of times worn on a Sunday: 13<br><br>&#x2022; Last worn on a Night 2<br>&#x2022; Last worn on a Saturday,&#x2022; Wore at previous show<br>&#x2022; Wore day before<br><br>&#x2022; Prior number of times worn: 72<br>&#x2022; Prior number of times worn on a Night 3: 15<br>&#x2022; Prior number of times worn on a Sunday: 13<br><br>&#x2022; Last worn on a Night 2<br>&#x2022; Last worn on a Saturday,&#x2022; Wore at previous show<br>&#x2022; Wore day before<br><br>&#x2022; Prior number of times worn: 72<br>&#x2022; Prior number of times worn on a Night 3: 15<br>&#x2022; Prior number of times worn on a Sunday: 13<br><br>&#x2022; Last worn on a Night 2<br>&#x2022; Last worn on a Saturday,&#x2022; Shows since last worn: 6<br>&#x2022; Days since last worn: 11<br><br>&#x2022; Prior number of times worn: 6<br>&#x2022; First time worn on a Night 3<br>&#x2022; Prior number of times worn on a Sunday: 1<br><br>&#x2022; Last worn on a Night 1<br>&#x2022; Last worn on a Wednesday,&#x2022; Shows since last worn: 8<br>&#x2022; Days since last worn: 85<br><br>&#x2022; Prior number of times worn: 19<br>&#x2022; Prior number of times worn on a Night 3: 3<br>&#x2022; Prior number of times worn on a Sunday: 4<br><br>&#x2022; Last worn on a Night 2<br>&#x2022; Last worn on a Saturday,&#x2022; Wore at previous show<br>&#x2022; Wore day before<br><br>&#x2022; Prior number of times worn: 11<br>&#x2022; Prior number of times worn on a Night 3: 3<br>&#x2022; Prior number of times worn on a Sunday: 2<br><br>&#x2022; Last worn on a Night 2<br>&#x2022; Last worn on a Saturday,&#x2022; Shows since last worn: 5<br>&#x2022; Days since last worn: 10<br><br>&#x2022; Prior number of times worn: 22<br>&#x2022; Prior number of times worn on a Night 3: 2<br>&#x2022; Prior number of times worn on a Sunday: 1<br><br>&#x2022; Last worn on a Night 2<br>&#x2022; Last worn on a Thursday
74,"Sydney, Australia",2024-02-23,Blue and Gold,Black,Blue,Fringe,Orange,A LOT GOING ON AT THE MOMENT,Black,Blue Ball Gown,Yes,Red and Black,Cream,Old Pink,,0,0,0,Pink,Orchid,Cutouts,Blue,"Friday, February 23, 2024",Friday,Sydney,,Australia,Asia-Pacific,1,4,"Sydney, Australia<br>Night 1",&#x2022; Shows since last worn: 2<br>&#x2022; Days since last worn: 6<br><br>&#x2022; Prior number of times worn: 25<br>&#x2022; Prior number of times worn on a Night 1: 3<br>&#x2022; Prior number of times worn on a Friday: 5<br><br>&#x2022; Last worn on a Night 2<br>&#x2022; Last worn on a Saturday,&#x2022; Shows since last worn: 2<br>&#x2022; Days since last worn: 6<br><br>&#x2022; Prior number of times worn: 26<br>&#x2022; Prior number of times worn on a Night 1: 4<br>&#x2022; Prior number of times worn on a Friday: 6<br><br>&#x2022; Last worn on a Night 2<br>&#x2022; Last worn on a Saturday,&#x2022; Shows since last worn: 2<br>&#x2022; Days since last worn: 6<br><br>&#x2022; Prior number of times worn: 24<br>&#x2022; Prior number of times worn on a Night 1: 2<br>&#x2022; Prior number of times worn on a Friday: 4<br><br>&#x2022; Last worn on a Night 2<br>&#x2022; Last worn on a Saturday,&#x2022; Shows since last worn: 3<br>&#x2022; Days since last worn: 7<br><br>&#x2022; Prior number of times worn: 37<br>&#x2022; Prior number of times worn on a Night 1: 17<br>&#x2022; Prior number of times worn on a Friday: 14<br><br>&#x2022; Last worn on a Night 1<br>&#x2022; Last worn on a Friday,&#x2022; Wore at previous show<br>&#x2022; Days since last worn: 5<br><br>&#x2022; Prior number of times worn: 63<br>&#x2022; Prior number of times worn on a Night 1: 24<br>&#x2022; Prior number of times worn on a Friday: 22<br><br>&#x2022; Last worn on a Night 3<br>&#x2022; Last worn on a Sunday,&#x2022; Shows since last worn: 3<br>&#x2022; Days since last worn: 7<br><br>&#x2022; Prior number of times worn: 30<br>&#x2022; Prior number of times worn on a Night 1: 12<br>&#x2022; Prior number of times worn on a Friday: 12<br><br>&#x2022; Last worn on a Night 1<br>&#x2022; Last worn on a Friday,&#x2022; Wore at previous show<br>&#x2022; Days since last worn: 5<br><br>&#x2022; Prior number of times worn: 68<br>&#x2022; Prior number of times worn on a Night 1: 23<br>&#x2022; Prior number of times worn on a Friday: 21<br><br>&#x2022; Last worn on a Night 3<br>&#x2022; Last worn on a Sunday,&#x2022; Wore at previous show<br>&#x2022; Days since last worn: 5<br><br>&#x2022; Prior number of times worn: 6<br>&#x2022; Prior number of times worn on a Night 1: 1<br>&#x2022; Prior number of times worn on a Friday: 2<br><br>&#x2022; Last worn on a Night 3<br>&#x2022; Last worn on a Sunday,&#x2022; Wore at previous show<br>&#x2022; Days since last worn: 5<br><br>&#x2022; Prior number of times worn: 34<br>&#x2022; Prior number of times worn on a Night 1: 11<br>&#x2022; Prior number of times worn on a Friday: 9<br><br>&#x2022; Last worn on a Night 3<br>&#x2022; Last worn on a Sunday,&#x2022; Wore at previous show<br>&#x2022; Days since last worn: 5<br><br>&#x2022; Prior number of times worn: 73<br>&#x2022; Prior number of times worn on a Night 1: 26<br>&#x2022; Prior number of times worn on a Friday: 24<br><br>&#x2022; Last worn on a Night 3<br>&#x2022; Last worn on a Sunday,&#x2022; Shows since last worn: 2<br>&#x2022; Days since last worn: 6<br><br>&#x2022; Prior number of times worn: 25<br>&#x2022; Prior number of times worn on a Night 1: 11<br>&#x2022; Prior number of times worn on a Friday: 9<br><br>&#x2022; Last worn on a Night 2<br>&#x2022; Last worn on a Saturday,&#x2022; Shows since last worn: 2<br>&#x2022; Days since last worn: 6<br><br>&#x2022; Prior number of times worn: 26<br>&#x2022; Prior number of times worn on a Night 1: 10<br>&#x2022; Prior number of times worn on a Friday: 12<br><br>&#x2022; Last worn on a Night 2<br>&#x2022; Last worn on a Saturday,&#x2022; Wore at previous show<br>&#x2022; Days since last worn: 5<br><br>&#x2022; Prior number of times worn: 73<br>&#x2022; Prior number of times worn on a Night 1: 26<br>&#x2022; Prior number of times worn on a Friday: 24<br><br>&#x2022; Last worn on a Night 3<br>&#x2022; Last worn on a Sunday,&#x2022; Wore at previous show<br>&#x2022; Days since last worn: 5<br><br>&#x2022; Prior number of times worn: 73<br>&#x2022; Prior number of times worn on a Night 1: 26<br>&#x2022; Prior number of times worn on a Friday: 24<br><br>&#x2022; Last worn on a Night 3<br>&#x2022; Last worn on a Sunday,&#x2022; Wore at previous show<br>&#x2022; Days since last worn: 5<br><br>&#x2022; Prior number of times worn: 73<br>&#x2022; Prior number of times worn on a Night 1: 26<br>&#x2022; Prior number of times worn on a Friday: 24<br><br>&#x2022; Last worn on a Night 3<br>&#x2022; Last worn on a Sunday,&#x2022; Wore at previous show<br>&#x2022; Days since last worn: 5<br><br>&#x2022; Prior number of times worn: 73<br>&#x2022; Prior number of times worn on a Night 1: 26<br>&#x2022; Prior number of times worn on a Friday: 24<br><br>&#x2022; Last worn on a Night 3<br>&#x2022; Last worn on a Sunday,&#x2022; Shows since last worn: 2<br>&#x2022; Days since last worn: 6<br><br>&#x2022; Prior number of times worn: 26<br>&#x2022; Prior number of times worn on a Night 1: 10<br>&#x2022; Prior number of times worn on a Friday: 12<br><br>&#x2022; Last worn on a Night 2<br>&#x2022; Last worn on a Saturday,&#x2022; Shows since last worn: 3<br>&#x2022; Days since last worn: 7<br><br>&#x2022; Prior number of times worn: 8<br>&#x2022; Prior number of times worn on a Night 1: 4<br>&#x2022; Prior number of times worn on a Friday: 4<br><br>&#x2022; Last worn on a Night 1<br>&#x2022; Last worn on a Friday,&#x2022; Wore at previous show<br>&#x2022; Days since last worn: 5<br><br>&#x2022; Prior number of times worn: 12<br>&#x2022; Prior number of times worn on a Night 1: 3<br>&#x2022; Prior number of times worn on a Friday: 4<br><br>&#x2022; Last worn on a Night 3<br>&#x2022; Last worn on a Sunday,&#x2022; Shows since last worn: 3<br>&#x2022; Days since last worn: 7<br><br>&#x2022; Prior number of times worn: 17<br>&#x2022; Prior number of times worn on a Night 1: 6<br>&#x2022; Prior number of times worn on a Friday: 3<br><br>&#x2022; Last worn on a Night 1<br>&#x2022; Last worn on a Friday
75,"Sydney, Australia",2024-02-24,Pink and Blue,Silver,Pink,Silver Noodle,Bronze,WHO'S TAYLOR SWIFT ANYWAY? EW.,Black,Purple Layers,Yes,Red and Black,Cream,Old Blue,,0,0,0,Blue,Iridescent,Cutouts,Magenta,"Saturday, February 24, 2024",Saturday,Sydney,,Australia,Asia-Pacific,2,4,"Sydney, Australia<br>Night 2",&#x2022; Shows since last worn: 4<br>&#x2022; Days since last worn: 8<br><br>&#x2022; Prior number of times worn: 35<br>&#x2022; Prior number of times worn on a Night 2: 7<br>&#x2022; Prior number of times worn on a Saturday: 8<br><br>&#x2022; Last worn on a Night 1<br>&#x2022; Last worn on a Friday,&#x2022; Shows since last worn: 4<br>&#x2022; Days since last worn: 8<br><br>&#x2022; Prior number of times worn: 38<br>&#x2022; Prior number of times worn on a Night 2: 9<br>&#x2022; Prior number of times worn on a Saturday: 10<br><br>&#x2022; Last worn on a Night 1<br>&#x2022; Last worn on a Friday,&#x2022; Shows since last worn: 2<br>&#x2022; Days since last worn: 6<br><br>&#x2022; Prior number of times worn: 30<br>&#x2022; Prior number of times worn on a Night 2: 4<br>&#x2022; Prior number of times worn on a Saturday: 5<br><br>&#x2022; Last worn on a Night 3<br>&#x2022; Last worn on a Sunday,&#x2022; Shows since last worn: 3<br>&#x2022; Days since last worn: 7<br><br>&#x2022; Prior number of times worn: 17<br>&#x2022; Prior number of times worn on a Night 2: 8<br>&#x2022; Prior number of times worn on a Saturday: 7<br><br>&#x2022; Last worn on a Night 2<br>&#x2022; Last worn on a Saturday,&#x2022; Shows since last worn: 3<br>&#x2022; Days since last worn: 7<br><br>&#x2022; Prior number of times worn: 10<br>&#x2022; Prior number of times worn on a Night 2: 5<br>&#x2022; Prior number of times worn on a Saturday: 3<br><br>&#x2022; Last worn on a Night 2<br>&#x2022; Last worn on a Saturday,&#x2022; Shows since last worn: 2<br>&#x2022; Days since last worn: 6<br><br>&#x2022; Prior number of times worn: 26<br>&#x2022; Prior number of times worn on a Night 2: 12<br>&#x2022; Prior number of times worn on a Saturday: 13<br><br>&#x2022; Last worn on a Night 3<br>&#x2022; Last worn on a Sunday,&#x2022; Wore at previous show<br>&#x2022; Wore day before<br><br>&#x2022; Prior number of times worn: 69<br>&#x2022; Prior number of times worn on a Night 2: 24<br>&#x2022; Prior number of times worn on a Saturday: 23<br><br>&#x2022; Last worn on a Night 1<br>&#x2022; Last worn on a Friday,&#x2022; Shows since last worn: 4<br>&#x2022; Days since last worn: 8<br><br>&#x2022; Prior number of times worn: 15<br>&#x2022; Prior number of times worn on a Night 2: 3<br>&#x2022; Prior number of times worn on a Saturday: 3<br><br>&#x2022; Last worn on a Night 1<br>&#x2022; Last worn on a Friday,&#x2022; Wore at previous show<br>&#x2022; Wore day before<br><br>&#x2022; Prior number of times worn: 35<br>&#x2022; Prior number of times worn on a Night 2: 11<br>&#x2022; Prior number of times worn on a Saturday: 10<br><br>&#x2022; Last worn on a Night 1<br>&#x2022; Last worn on a Friday,&#x2022; Wore at previous show<br>&#x2022; Wore day before<br><br>&#x2022; Prior number of times worn: 74<br>&#x2022; Prior number of times worn on a Night 2: 26<br>&#x2022; Prior number of times worn on a Saturday: 25<br><br>&#x2022; Last worn on a Night 1<br>&#x2022; Last worn on a Friday,&#x2022; Wore at previous show<br>&#x2022; Wore day before<br><br>&#x2022; Prior number of times worn: 26<br>&#x2022; Prior number of times worn on a Night 2: 10<br>&#x2022; Prior number of times worn on a Saturday: 10<br><br>&#x2022; Last worn on a Night 1<br>&#x2022; Last worn on a Friday,&#x2022; Shows since last worn: 2<br>&#x2022; Days since last worn: 6<br><br>&#x2022; Prior number of times worn: 7<br>&#x2022; Prior number of times worn on a Night 2: 1<br>&#x2022; First time worn on a Saturday<br><br>&#x2022; Last worn on a Night 3<br>&#x2022; Last worn on a Sunday,&#x2022; Wore at previous show<br>&#x2022; Wore day before<br><br>&#x2022; Prior number of times worn: 74<br>&#x2022; Prior number of times worn on a Night 2: 26<br>&#x2022; Prior number of times worn on a Saturday: 25<br><br>&#x2022; Last worn on a Night 1<br>&#x2022; Last worn on a Friday,&#x2022; Wore at previous show<br>&#x2022; Wore day before<br><br>&#x2022; Prior number of times worn: 74<br>&#x2022; Prior number of times worn on a Night 2: 26<br>&#x2022; Prior number of times worn on a Saturday: 25<br><br>&#x2022; Last worn on a Night 1<br>&#x2022; Last worn on a Friday,&#x2022; Wore at previous show<br>&#x2022; Wore day before<br><br>&#x2022; Prior number of times worn: 74<br>&#x2022; Prior number of times worn on a Night 2: 26<br>&#x2022; Prior number of times worn on a Saturday: 25<br><br>&#x2022; Last worn on a Night 1<br>&#x2022; Last worn on a Friday,&#x2022; Wore at previous show<br>&#x2022; Wore day before<br><br>&#x2022; Prior number of times worn: 74<br>&#x2022; Prior number of times worn on a Night 2: 26<br>&#x2022; Prior number of times worn on a Saturday: 25<br><br>&#x2022; Last worn on a Night 1<br>&#x2022; Last worn on a Friday,&#x2022; Shows since last worn: 2<br>&#x2022; Days since last worn: 6<br><br>&#x2022; Prior number of times worn: 7<br>&#x2022; Prior number of times worn on a Night 2: 1<br>&#x2022; First time worn on a Saturday<br><br>&#x2022; Last worn on a Night 3<br>&#x2022; Last worn on a Sunday,&#x2022; Shows since last worn: 3<br>&#x2022; Days since last worn: 7<br><br>&#x2022; Prior number of times worn: 16<br>&#x2022; Prior number of times worn on a Night 2: 5<br>&#x2022; Prior number of times worn on a Saturday: 5<br><br>&#x2022; Last worn on a Night 2<br>&#x2022; Last worn on a Saturday,&#x2022; Wore at previous show<br>&#x2022; Wore day before<br><br>&#x2022; Prior number of times worn: 13<br>&#x2022; Prior number of times worn on a Night 2: 2<br>&#x2022; Prior number of times worn on a Saturday: 2<br><br>&#x2022; Last worn on a Night 1<br>&#x2022; Last worn on a Friday,&#x2022; Shows since last worn: 2<br>&#x2022; Days since last worn: 6<br><br>&#x2022; Prior number of times worn: 23<br>&#x2022; Prior number of times worn on a Night 2: 11<br>&#x2022; Prior number of times worn on a Saturday: 11<br><br>&#x2022; Last worn on a Night 3<br>&#x2022; Last worn on a Sunday
76,"Sydney, Australia",2024-02-25,Purple Tassels,Indigo,Purple,Gold Noodle,Orange,WE ARE NEVER GETTING BACK TOGETHER.<br>LIKE EVER.,Black,Pink Ball Gown,Yes,Red and Black,Purple,Old Orange,,0,0,0,Yellow,Silver Sequin,Cutouts,Multicolor,"Sunday, February 25, 2024",Sunday,Sydney,,Australia,Asia-Pacific,3,4,"Sydney, Australia<br>Night 3",&#x2022; Shows since last worn: 7<br>&#x2022; Days since last worn: 16<br><br>&#x2022; Prior number of times worn: 8<br>&#x2022; Prior number of times worn on a Night 3: 3<br>&#x2022; First time worn on a Sunday<br><br>&#x2022; Last worn on a Night 3<br>&#x2022; Last worn on a Friday,&#x2022; Shows since last worn: 7<br>&#x2022; Days since last worn: 16<br><br>&#x2022; Prior number of times worn: 4<br>&#x2022; Prior number of times worn on a Night 3: 3<br>&#x2022; First time worn on a Sunday<br><br>&#x2022; Last worn on a Night 3<br>&#x2022; Last worn on a Friday,&#x2022; Shows since last worn: 7<br>&#x2022; Days since last worn: 16<br><br>&#x2022; Prior number of times worn: 19<br>&#x2022; Prior number of times worn on a Night 3: 11<br>&#x2022; Prior number of times worn on a Sunday: 8<br><br>&#x2022; Last worn on a Night 3<br>&#x2022; Last worn on a Friday,&#x2022; Shows since last worn: 3<br>&#x2022; Days since last worn: 7<br><br>&#x2022; Prior number of times worn: 19<br>&#x2022; Prior number of times worn on a Night 3: 7<br>&#x2022; Prior number of times worn on a Sunday: 4<br><br>&#x2022; Last worn on a Night 3<br>&#x2022; Last worn on a Sunday,&#x2022; Shows since last worn: 2<br>&#x2022; Days since last worn: 2<br><br>&#x2022; Prior number of times worn: 64<br>&#x2022; Prior number of times worn on a Night 3: 14<br>&#x2022; Prior number of times worn on a Sunday: 11<br><br>&#x2022; Last worn on a Night 1<br>&#x2022; Last worn on a Friday,&#x2022; Shows since last worn: 4<br>&#x2022; Days since last worn: 8<br><br>&#x2022; Prior number of times worn: 17<br>&#x2022; Prior number of times worn on a Night 3: 9<br>&#x2022; Prior number of times worn on a Sunday: 6<br><br>&#x2022; Last worn on a Night 2<br>&#x2022; Last worn on a Saturday,&#x2022; Wore at previous show<br>&#x2022; Wore day before<br><br>&#x2022; Prior number of times worn: 70<br>&#x2022; Prior number of times worn on a Night 3: 16<br>&#x2022; Prior number of times worn on a Sunday: 14<br><br>&#x2022; Last worn on a Night 2<br>&#x2022; Last worn on a Saturday,&#x2022; Shows since last worn: 7<br>&#x2022; Days since last worn: 16<br><br>&#x2022; Prior number of times worn: 19<br>&#x2022; Prior number of times worn on a Night 3: 3<br>&#x2022; Prior number of times worn on a Sunday: 3<br><br>&#x2022; Last worn on a Night 3<br>&#x2022; Last worn on a Friday,&#x2022; Wore at previous show<br>&#x2022; Wore day before<br><br>&#x2022; Prior number of times worn: 36<br>&#x2022; Prior number of times worn on a Night 3: 7<br>&#x2022; Prior number of times worn on a Sunday: 6<br><br>&#x2022; Last worn on a Night 2<br>&#x2022; Last worn on a Saturday,&#x2022; Wore at previous show<br>&#x2022; Wore day before<br><br>&#x2022; Prior number of times worn: 75<br>&#x2022; Prior number of times worn on a Night 3: 16<br>&#x2022; Prior number of times worn on a Sunday: 14<br><br>&#x2022; Last worn on a Night 2<br>&#x2022; Last worn on a Saturday,&#x2022; Shows since last worn: 3<br>&#x2022; Days since last worn: 7<br><br>&#x2022; Prior number of times worn: 13<br>&#x2022; Prior number of times worn on a Night 3: 4<br>&#x2022; Prior number of times worn on a Sunday: 4<br><br>&#x2022; Last worn on a Night 3<br>&#x2022; Last worn on a Sunday,&#x2022; Shows since last worn: 5<br>&#x2022; Days since last worn: 9<br><br>&#x2022; Prior number of times worn: 21<br>&#x2022; Prior number of times worn on a Night 3: 5<br>&#x2022; Prior number of times worn on a Sunday: 7<br><br>&#x2022; Last worn on a Night 1<br>&#x2022; Last worn on a Friday,&#x2022; Wore at previous show<br>&#x2022; Wore day before<br><br>&#x2022; Prior number of times worn: 75<br>&#x2022; Prior number of times worn on a Night 3: 16<br>&#x2022; Prior number of times worn on a Sunday: 14<br><br>&#x2022; Last worn on a Night 2<br>&#x2022; Last worn on a Saturday,&#x2022; Wore at previous show<br>&#x2022; Wore day before<br><br>&#x2022; Prior number of times worn: 75<br>&#x2022; Prior number of times worn on a Night 3: 16<br>&#x2022; Prior number of times worn on a Sunday: 14<br><br>&#x2022; Last worn on a Night 2<br>&#x2022; Last worn on a Saturday,&#x2022; Wore at previous show<br>&#x2022; Wore day before<br><br>&#x2022; Prior number of times worn: 75<br>&#x2022; Prior number of times worn on a Night 3: 16<br>&#x2022; Prior number of times worn on a Sunday: 14<br><br>&#x2022; Last worn on a Night 2<br>&#x2022; Last worn on a Saturday,&#x2022; Wore at previous show<br>&#x2022; Wore day before<br><br>&#x2022; Prior number of times worn: 75<br>&#x2022; Prior number of times worn on a Night 3: 16<br>&#x2022; Prior number of times worn on a Sunday: 14<br><br>&#x2022; Last worn on a Night 2<br>&#x2022; Last worn on a Saturday,&#x2022; Shows since last worn: 5<br>&#x2022; Days since last worn: 9<br><br>&#x2022; Prior number of times worn: 21<br>&#x2022; Prior number of times worn on a Night 3: 5<br>&#x2022; Prior number of times worn on a Sunday: 7<br><br>&#x2022; Last worn on a Night 1<br>&#x2022; Last worn on a Friday,&#x2022; Shows since last worn: 3<br>&#x2022; Days since last worn: 7<br><br>&#x2022; Prior number of times worn: 20<br>&#x2022; Prior number of times worn on a Night 3: 4<br>&#x2022; Prior number of times worn on a Sunday: 5<br><br>&#x2022; Last worn on a Night 3<br>&#x2022; Last worn on a Sunday,&#x2022; Wore at previous show<br>&#x2022; Wore day before<br><br>&#x2022; Prior number of times worn: 14<br>&#x2022; Prior number of times worn on a Night 3: 4<br>&#x2022; Prior number of times worn on a Sunday: 3<br><br>&#x2022; Last worn on a Night 2<br>&#x2022; Last worn on a Saturday,&#x2022; Shows since last worn: 4<br>&#x2022; Days since last worn: 8<br><br>&#x2022; Prior number of times worn: 25<br>&#x2022; Prior number of times worn on a Night 3: 6<br>&#x2022; Prior number of times worn on a Sunday: 5<br><br>&#x2022; Last worn on a Night 2<br>&#x2022; Last worn on a Saturday
