concert_num,location,date,lover_bodysuit,lover_jacket,lover_guitar,fearless_dress,evermore,red_tshirt,red_guitar,speaknow,koi,reputation,folklore,1989_1,1989_2,ttpd_dress,ttpd_twopiece,ttpd_coverall,surprise_song,midnights_shirt,midnights_bodysuit,midnights_karmajacket,date_str,date_weekday,location_city,location_state_region,location_country,tour_leg,night_num,night_count,location_night,lover_bodysuit_n_since_last,lover_jacket_n_since_last,lover_guitar_n_since_last,fearless_dress_n_since_last,evermore_n_since_last,red_tshirt_n_since_last,red_guitar_n_since_last,speaknow_n_since_last,koi_n_since_last,reputation_n_since_last,folklore_n_since_last,1989_1_n_since_last,1989_2_n_since_last,ttpd_dress_n_since_last,ttpd_twopiece_n_since_last,ttpd_coverall_n_since_last,surprise_song_n_since_last,midnights_shirt_n_since_last,midnights_bodysuit_n_since_last,midnights_karmajacket_n_since_last
37,"Minneapolis, Minnesota, USA",2023-06-24,Purple Tassels,Silver,Purple,Silver Noodle,Orange,A LOT GOING ON AT THE MOMENT,Black,Pink Ball Gown,No,Red and Black,Pink Lace,Old Pink,,0,0,0,Pink,Iridescent,Navy,Magenta,"Saturday, June 24, 2023",Saturday,Minneapolis,Minnesota,USA,US and Canada,2,2,"Minneapolis, Minnesota, USA<br>Night 2",&#x2022; Shows since last worn: 7<br>&#x2022; Days since last worn: 21<br><br>&#x2022; Prior number of times worn: 2<br>&#x2022; Prior number of times worn on a Night 2: 1<br>&#x2022; Prior number of times worn on a Saturday: 1<br><br>&#x2022; Last worn on a Night 2<br>&#x2022; Last worn on a Saturday,&#x2022; Shows since last worn: 3<br>&#x2022; Days since last worn: 8<br><br>&#x2022; Prior number of times worn: 21<br>&#x2022; Prior number of times worn on a Night 2: 3<br>&#x2022; Prior number of times worn on a Saturday: 4<br><br>&#x2022; Last worn on a Night 1<br>&#x2022; Last worn on a Friday,&#x2022; Shows since last worn: 6<br>&#x2022; Days since last worn: 20<br><br>&#x2022; Prior number of times worn: 11<br>&#x2022; Prior number of times worn on a Night 2: 1<br>&#x2022; Prior number of times worn on a Saturday: 2<br><br>&#x2022; Last worn on a Night 3<br>&#x2022; Last worn on a Sunday,&#x2022; Shows since last worn: 3<br>&#x2022; Days since last worn: 8<br><br>&#x2022; Prior number of times worn: 5<br>&#x2022; Prior number of times worn on a Night 2: 3<br>&#x2022; Prior number of times worn on a Saturday: 3<br><br>&#x2022; Last worn on a Night 1<br>&#x2022; Last worn on a Friday,&#x2022; Wore at previous show<br>&#x2022; Wore day before<br><br>&#x2022; Prior number of times worn: 34<br>&#x2022; Prior number of times worn on a Night 2: 13<br>&#x2022; Prior number of times worn on a Saturday: 13<br><br>&#x2022; Last worn on a Night 1<br>&#x2022; Last worn on a Friday,&#x2022; Shows since last worn: 5<br>&#x2022; Days since last worn: 15<br><br>&#x2022; Prior number of times worn: 12<br>&#x2022; Prior number of times worn on a Night 2: 5<br>&#x2022; Prior number of times worn on a Saturday: 4<br><br>&#x2022; Last worn on a Night 1<br>&#x2022; Last worn on a Friday,&#x2022; Wore at previous show<br>&#x2022; Wore day before<br><br>&#x2022; Prior number of times worn: 31<br>&#x2022; Prior number of times worn on a Night 2: 11<br>&#x2022; Prior number of times worn on a Saturday: 11<br><br>&#x2022; Last worn on a Night 1<br>&#x2022; Last worn on a Friday,&#x2022; Shows since last worn: 2<br>&#x2022; Days since last worn: 7<br><br>&#x2022; Prior number of times worn: 13<br>&#x2022; Prior number of times worn on a Night 2: 8<br>&#x2022; Prior number of times worn on a Saturday: 7<br><br>&#x2022; Last worn on a Night 2<br>&#x2022; Last worn on a Saturday,&#x2022; Wore at previous show<br>&#x2022; Wore day before<br><br>&#x2022; Prior number of times worn: 36<br>&#x2022; Prior number of times worn on a Night 2: 13<br>&#x2022; Prior number of times worn on a Saturday: 13<br><br>&#x2022; Last worn on a Night 1<br>&#x2022; Last worn on a Friday,&#x2022; Wore at previous show<br>&#x2022; Wore day before<br><br>&#x2022; Prior number of times worn: 36<br>&#x2022; Prior number of times worn on a Night 2: 13<br>&#x2022; Prior number of times worn on a Saturday: 13<br><br>&#x2022; Last worn on a Night 1<br>&#x2022; Last worn on a Friday,&#x2022; Shows since last worn: 6<br>&#x2022; Days since last worn: 20<br><br>&#x2022; Prior number of times worn: 8<br>&#x2022; Prior number of times worn on a Night 2: 1<br>&#x2022; Prior number of times worn on a Saturday: 2<br><br>&#x2022; Last worn on a Night 3<br>&#x2022; Last worn on a Sunday,&#x2022; Shows since last worn: 2<br>&#x2022; Days since last worn: 7<br><br>&#x2022; Prior number of times worn: 13<br>&#x2022; Prior number of times worn on a Night 2: 5<br>&#x2022; Prior number of times worn on a Saturday: 4<br><br>&#x2022; Last worn on a Night 2<br>&#x2022; Last worn on a Saturday,&#x2022; Wore at previous show<br>&#x2022; Wore day before<br><br>&#x2022; Prior number of times worn: 36<br>&#x2022; Prior number of times worn on a Night 2: 13<br>&#x2022; Prior number of times worn on a Saturday: 13<br><br>&#x2022; Last worn on a Night 1<br>&#x2022; Last worn on a Friday,&#x2022; Wore at previous show<br>&#x2022; Wore day before<br><br>&#x2022; Prior number of times worn: 36<br>&#x2022; Prior number of times worn on a Night 2: 13<br>&#x2022; Prior number of times worn on a Saturday: 13<br><br>&#x2022; Last worn on a Night 1<br>&#x2022; Last worn on a Friday,&#x2022; Wore at previous show<br>&#x2022; Wore day before<br><br>&#x2022; Prior number of times worn: 36<br>&#x2022; Prior number of times worn on a Night 2: 13<br>&#x2022; Prior number of times worn on a Saturday: 13<br><br>&#x2022; Last worn on a Night 1<br>&#x2022; Last worn on a Friday,&#x2022; Wore at previous show<br>&#x2022; Wore day before<br><br>&#x2022; Prior number of times worn: 36<br>&#x2022; Prior number of times worn on a Night 2: 13<br>&#x2022; Prior number of times worn on a Saturday: 13<br><br>&#x2022; Last worn on a Night 1<br>&#x2022; Last worn on a Friday,&#x2022; Shows since last worn: 2<br>&#x2022; Days since last worn: 7<br><br>&#x2022; Prior number of times worn: 13<br>&#x2022; Prior number of times worn on a Night 2: 5<br>&#x2022; Prior number of times worn on a Saturday: 4<br><br>&#x2022; Last worn on a Night 2<br>&#x2022; Last worn on a Saturday,&#x2022; Shows since last worn: 3<br>&#x2022; Days since last worn: 8<br><br>&#x2022; Prior number of times worn: 4<br>&#x2022; Prior number of times worn on a Night 2: 1<br>&#x2022; Prior number of times worn on a Saturday: 1<br><br>&#x2022; Last worn on a Night 1<br>&#x2022; Last worn on a Friday,&#x2022; Shows since last worn: 3<br>&#x2022; Days since last worn: 8<br><br>&#x2022; Prior number of times worn: 17<br>&#x2022; Prior number of times worn on a Night 2: 6<br>&#x2022; Prior number of times worn on a Saturday: 5<br><br>&#x2022; Last worn on a Night 1<br>&#x2022; Last worn on a Friday,&#x2022; Shows since last worn: 3<br>&#x2022; Days since last worn: 8<br><br>&#x2022; Prior number of times worn: 11<br>&#x2022; Prior number of times worn on a Night 2: 5<br>&#x2022; Prior number of times worn on a Saturday: 6<br><br>&#x2022; Last worn on a Night 1<br>&#x2022; Last worn on a Friday
38,"Cincinnati, Ohio, USA",2023-06-30,Pink and Blue,Silver,Pink,Fringe,Orange,A LOT GOING ON AT THE MOMENT,Black,Silver Ball Gown,No,Red and Black,Cream,Old Pink,,0,0,0,Pink,Iridescent,Blurple,Magenta,"Friday, June 30, 2023",Friday,Cincinnati,Ohio,USA,US and Canada,1,2,"Cincinnati, Ohio, USA<br>Night 1",&#x2022; Shows since last worn: 4<br>&#x2022; Days since last worn: 14<br><br>&#x2022; Prior number of times worn: 19<br>&#x2022; Prior number of times worn on a Night 1: 11<br>&#x2022; Prior number of times worn on a Friday: 10<br><br>&#x2022; Last worn on a Night 1<br>&#x2022; Last worn on a Friday,&#x2022; Wore at previous show<br>&#x2022; Days since last worn: 6<br><br>&#x2022; Prior number of times worn: 22<br>&#x2022; Prior number of times worn on a Night 1: 12<br>&#x2022; Prior number of times worn on a Friday: 11<br><br>&#x2022; Last worn on a Night 2<br>&#x2022; Last worn on a Saturday,&#x2022; Shows since last worn: 2<br>&#x2022; Days since last worn: 7<br><br>&#x2022; Prior number of times worn: 13<br>&#x2022; Prior number of times worn on a Night 1: 11<br>&#x2022; Prior number of times worn on a Friday: 10<br><br>&#x2022; Last worn on a Night 1<br>&#x2022; Last worn on a Friday,&#x2022; Shows since last worn: 2<br>&#x2022; Days since last worn: 7<br><br>&#x2022; Prior number of times worn: 20<br>&#x2022; Prior number of times worn on a Night 1: 12<br>&#x2022; Prior number of times worn on a Friday: 11<br><br>&#x2022; Last worn on a Night 1<br>&#x2022; Last worn on a Friday,&#x2022; Wore at previous show<br>&#x2022; Days since last worn: 6<br><br>&#x2022; Prior number of times worn: 35<br>&#x2022; Prior number of times worn on a Night 1: 13<br>&#x2022; Prior number of times worn on a Friday: 13<br><br>&#x2022; Last worn on a Night 2<br>&#x2022; Last worn on a Saturday,&#x2022; Wore at previous show<br>&#x2022; Days since last worn: 6<br><br>&#x2022; Prior number of times worn: 13<br>&#x2022; Prior number of times worn on a Night 1: 6<br>&#x2022; Prior number of times worn on a Friday: 7<br><br>&#x2022; Last worn on a Night 2<br>&#x2022; Last worn on a Saturday,&#x2022; Wore at previous show<br>&#x2022; Days since last worn: 6<br><br>&#x2022; Prior number of times worn: 32<br>&#x2022; Prior number of times worn on a Night 1: 11<br>&#x2022; Prior number of times worn on a Friday: 11<br><br>&#x2022; Last worn on a Night 2<br>&#x2022; Last worn on a Saturday,&#x2022; Shows since last worn: 12<br>&#x2022; Days since last worn: 35<br><br>&#x2022; Prior number of times worn: 1<br>&#x2022; Prior number of times worn on a Night 1: 1<br>&#x2022; Prior number of times worn on a Friday: 1<br><br>&#x2022; Last worn on a Night 1<br>&#x2022; Last worn on a Friday,&#x2022; Wore at previous show<br>&#x2022; Days since last worn: 6<br><br>&#x2022; Prior number of times worn: 37<br>&#x2022; Prior number of times worn on a Night 1: 14<br>&#x2022; Prior number of times worn on a Friday: 14<br><br>&#x2022; Last worn on a Night 2<br>&#x2022; Last worn on a Saturday,&#x2022; Wore at previous show<br>&#x2022; Days since last worn: 6<br><br>&#x2022; Prior number of times worn: 37<br>&#x2022; Prior number of times worn on a Night 1: 14<br>&#x2022; Prior number of times worn on a Friday: 14<br><br>&#x2022; Last worn on a Night 2<br>&#x2022; Last worn on a Saturday,&#x2022; Shows since last worn: 3<br>&#x2022; Days since last worn: 13<br><br>&#x2022; Prior number of times worn: 12<br>&#x2022; Prior number of times worn on a Night 1: 6<br>&#x2022; Prior number of times worn on a Friday: 7<br><br>&#x2022; Last worn on a Night 2<br>&#x2022; Last worn on a Saturday,&#x2022; Wore at previous show<br>&#x2022; Days since last worn: 6<br><br>&#x2022; Prior number of times worn: 14<br>&#x2022; Prior number of times worn on a Night 1: 7<br>&#x2022; Prior number of times worn on a Friday: 8<br><br>&#x2022; Last worn on a Night 2<br>&#x2022; Last worn on a Saturday,&#x2022; Wore at previous show<br>&#x2022; Days since last worn: 6<br><br>&#x2022; Prior number of times worn: 37<br>&#x2022; Prior number of times worn on a Night 1: 14<br>&#x2022; Prior number of times worn on a Friday: 14<br><br>&#x2022; Last worn on a Night 2<br>&#x2022; Last worn on a Saturday,&#x2022; Wore at previous show<br>&#x2022; Days since last worn: 6<br><br>&#x2022; Prior number of times worn: 37<br>&#x2022; Prior number of times worn on a Night 1: 14<br>&#x2022; Prior number of times worn on a Friday: 14<br><br>&#x2022; Last worn on a Night 2<br>&#x2022; Last worn on a Saturday,&#x2022; Wore at previous show<br>&#x2022; Days since last worn: 6<br><br>&#x2022; Prior number of times worn: 37<br>&#x2022; Prior number of times worn on a Night 1: 14<br>&#x2022; Prior number of times worn on a Friday: 14<br><br>&#x2022; Last worn on a Night 2<br>&#x2022; Last worn on a Saturday,&#x2022; Wore at previous show<br>&#x2022; Days since last worn: 6<br><br>&#x2022; Prior number of times worn: 37<br>&#x2022; Prior number of times worn on a Night 1: 14<br>&#x2022; Prior number of times worn on a Friday: 14<br><br>&#x2022; Last worn on a Night 2<br>&#x2022; Last worn on a Saturday,&#x2022; Wore at previous show<br>&#x2022; Days since last worn: 6<br><br>&#x2022; Prior number of times worn: 14<br>&#x2022; Prior number of times worn on a Night 1: 7<br>&#x2022; Prior number of times worn on a Friday: 8<br><br>&#x2022; Last worn on a Night 2<br>&#x2022; Last worn on a Saturday,&#x2022; Wore at previous show<br>&#x2022; Days since last worn: 6<br><br>&#x2022; Prior number of times worn: 5<br>&#x2022; Prior number of times worn on a Night 1: 3<br>&#x2022; Prior number of times worn on a Friday: 3<br><br>&#x2022; Last worn on a Night 2<br>&#x2022; Last worn on a Saturday,&#x2022; Shows since last worn: 2<br>&#x2022; Days since last worn: 7<br><br>&#x2022; Prior number of times worn: 19<br>&#x2022; Prior number of times worn on a Night 1: 7<br>&#x2022; Prior number of times worn on a Friday: 6<br><br>&#x2022; Last worn on a Night 1<br>&#x2022; Last worn on a Friday,&#x2022; Wore at previous show<br>&#x2022; Days since last worn: 6<br><br>&#x2022; Prior number of times worn: 12<br>&#x2022; Prior number of times worn on a Night 1: 4<br>&#x2022; Prior number of times worn on a Friday: 4<br><br>&#x2022; Last worn on a Night 2<br>&#x2022; Last worn on a Saturday
39,"Cincinnati, Ohio, USA",2023-07-01,Blue and Gold,Black,Blue,Silver Noodle,Orange,WHO'S TAYLOR SWIFT ANYWAY? EW.,Black,Pink Ball Gown,No,Red and Black,Green Leaves,Old Orange,,0,0,0,Yellow,Silver Sequin,Navy,Multicolor,"Saturday, July 01, 2023",Saturday,Cincinnati,Ohio,USA,US and Canada,2,2,"Cincinnati, Ohio, USA<br>Night 2",&#x2022; Shows since last worn: 3<br>&#x2022; Days since last worn: 8<br><br>&#x2022; Prior number of times worn: 15<br>&#x2022; Prior number of times worn on a Night 2: 10<br>&#x2022; Prior number of times worn on a Saturday: 9<br><br>&#x2022; Last worn on a Night 1<br>&#x2022; Last worn on a Friday,&#x2022; Shows since last worn: 3<br>&#x2022; Days since last worn: 8<br><br>&#x2022; Prior number of times worn: 15<br>&#x2022; Prior number of times worn on a Night 2: 10<br>&#x2022; Prior number of times worn on a Saturday: 9<br><br>&#x2022; Last worn on a Night 1<br>&#x2022; Last worn on a Friday,&#x2022; Shows since last worn: 4<br>&#x2022; Days since last worn: 14<br><br>&#x2022; Prior number of times worn: 12<br>&#x2022; Prior number of times worn on a Night 2: 11<br>&#x2022; Prior number of times worn on a Saturday: 10<br><br>&#x2022; Last worn on a Night 2<br>&#x2022; Last worn on a Saturday,&#x2022; Shows since last worn: 2<br>&#x2022; Days since last worn: 7<br><br>&#x2022; Prior number of times worn: 6<br>&#x2022; Prior number of times worn on a Night 2: 4<br>&#x2022; Prior number of times worn on a Saturday: 4<br><br>&#x2022; Last worn on a Night 2<br>&#x2022; Last worn on a Saturday,&#x2022; Wore at previous show<br>&#x2022; Wore day before<br><br>&#x2022; Prior number of times worn: 36<br>&#x2022; Prior number of times worn on a Night 2: 14<br>&#x2022; Prior number of times worn on a Saturday: 14<br><br>&#x2022; Last worn on a Night 1<br>&#x2022; Last worn on a Friday,&#x2022; Shows since last worn: 3<br>&#x2022; Days since last worn: 8<br><br>&#x2022; Prior number of times worn: 15<br>&#x2022; Prior number of times worn on a Night 2: 8<br>&#x2022; Prior number of times worn on a Saturday: 9<br><br>&#x2022; Last worn on a Night 1<br>&#x2022; Last worn on a Friday,&#x2022; Wore at previous show<br>&#x2022; Wore day before<br><br>&#x2022; Prior number of times worn: 33<br>&#x2022; Prior number of times worn on a Night 2: 12<br>&#x2022; Prior number of times worn on a Saturday: 12<br><br>&#x2022; Last worn on a Night 1<br>&#x2022; Last worn on a Friday,&#x2022; Shows since last worn: 2<br>&#x2022; Days since last worn: 7<br><br>&#x2022; Prior number of times worn: 14<br>&#x2022; Prior number of times worn on a Night 2: 9<br>&#x2022; Prior number of times worn on a Saturday: 8<br><br>&#x2022; Last worn on a Night 2<br>&#x2022; Last worn on a Saturday,&#x2022; Wore at previous show<br>&#x2022; Wore day before<br><br>&#x2022; Prior number of times worn: 38<br>&#x2022; Prior number of times worn on a Night 2: 14<br>&#x2022; Prior number of times worn on a Saturday: 14<br><br>&#x2022; Last worn on a Night 1<br>&#x2022; Last worn on a Friday,&#x2022; Wore at previous show<br>&#x2022; Wore day before<br><br>&#x2022; Prior number of times worn: 38<br>&#x2022; Prior number of times worn on a Night 2: 14<br>&#x2022; Prior number of times worn on a Saturday: 14<br><br>&#x2022; Last worn on a Night 1<br>&#x2022; Last worn on a Friday,&#x2022; Shows since last worn: 5<br>&#x2022; Days since last worn: 15<br><br>&#x2022; Prior number of times worn: 7<br>&#x2022; Prior number of times worn on a Night 2: 2<br>&#x2022; Prior number of times worn on a Saturday: 2<br><br>&#x2022; Last worn on a Night 1<br>&#x2022; Last worn on a Friday,&#x2022; Shows since last worn: 5<br>&#x2022; Days since last worn: 15<br><br>&#x2022; Prior number of times worn: 10<br>&#x2022; Prior number of times worn on a Night 2: 2<br>&#x2022; Prior number of times worn on a Saturday: 2<br><br>&#x2022; Last worn on a Night 1<br>&#x2022; Last worn on a Friday,&#x2022; Wore at previous show<br>&#x2022; Wore day before<br><br>&#x2022; Prior number of times worn: 38<br>&#x2022; Prior number of times worn on a Night 2: 14<br>&#x2022; Prior number of times worn on a Saturday: 14<br><br>&#x2022; Last worn on a Night 1<br>&#x2022; Last worn on a Friday,&#x2022; Wore at previous show<br>&#x2022; Wore day before<br><br>&#x2022; Prior number of times worn: 38<br>&#x2022; Prior number of times worn on a Night 2: 14<br>&#x2022; Prior number of times worn on a Saturday: 14<br><br>&#x2022; Last worn on a Night 1<br>&#x2022; Last worn on a Friday,&#x2022; Wore at previous show<br>&#x2022; Wore day before<br><br>&#x2022; Prior number of times worn: 38<br>&#x2022; Prior number of times worn on a Night 2: 14<br>&#x2022; Prior number of times worn on a Saturday: 14<br><br>&#x2022; Last worn on a Night 1<br>&#x2022; Last worn on a Friday,&#x2022; Wore at previous show<br>&#x2022; Wore day before<br><br>&#x2022; Prior number of times worn: 38<br>&#x2022; Prior number of times worn on a Night 2: 14<br>&#x2022; Prior number of times worn on a Saturday: 14<br><br>&#x2022; Last worn on a Night 1<br>&#x2022; Last worn on a Friday,&#x2022; Shows since last worn: 5<br>&#x2022; Days since last worn: 15<br><br>&#x2022; Prior number of times worn: 10<br>&#x2022; Prior number of times worn on a Night 2: 2<br>&#x2022; Prior number of times worn on a Saturday: 2<br><br>&#x2022; Last worn on a Night 1<br>&#x2022; Last worn on a Friday,&#x2022; Shows since last worn: 4<br>&#x2022; Days since last worn: 14<br><br>&#x2022; Prior number of times worn: 13<br>&#x2022; Prior number of times worn on a Night 2: 6<br>&#x2022; Prior number of times worn on a Saturday: 5<br><br>&#x2022; Last worn on a Night 2<br>&#x2022; Last worn on a Saturday,&#x2022; Shows since last worn: 2<br>&#x2022; Days since last worn: 7<br><br>&#x2022; Prior number of times worn: 18<br>&#x2022; Prior number of times worn on a Night 2: 7<br>&#x2022; Prior number of times worn on a Saturday: 6<br><br>&#x2022; Last worn on a Night 2<br>&#x2022; Last worn on a Saturday,&#x2022; Shows since last worn: 3<br>&#x2022; Days since last worn: 8<br><br>&#x2022; Prior number of times worn: 17<br>&#x2022; Prior number of times worn on a Night 2: 4<br>&#x2022; Prior number of times worn on a Saturday: 4<br><br>&#x2022; Last worn on a Night 1<br>&#x2022; Last worn on a Friday
40,"Kansas City, Missouri, USA",2023-07-07,Purple Tassels,Silver,Purple,Gold Noodle,Orange,WE ARE NEVER GETTING BACK TOGETHER.<br>LIKE EVER.,Black,Purple Layers,Yes,Red and Black,Purple,Old Orange,,0,0,0,Yellow,Orchid,Blurple,Multicolor,"Friday, July 07, 2023",Friday,Kansas City,Missouri,USA,US and Canada,1,2,"Kansas City, Missouri, USA<br>Night 1",&#x2022; Shows since last worn: 3<br>&#x2022; Days since last worn: 13<br><br>&#x2022; Prior number of times worn: 3<br>&#x2022; Prior number of times worn on a Night 1: 1<br>&#x2022; Prior number of times worn on a Friday: 1<br><br>&#x2022; Last worn on a Night 2<br>&#x2022; Last worn on a Saturday,&#x2022; Shows since last worn: 2<br>&#x2022; Days since last worn: 7<br><br>&#x2022; Prior number of times worn: 23<br>&#x2022; Prior number of times worn on a Night 1: 13<br>&#x2022; Prior number of times worn on a Friday: 12<br><br>&#x2022; Last worn on a Night 1<br>&#x2022; Last worn on a Friday,&#x2022; Shows since last worn: 3<br>&#x2022; Days since last worn: 13<br><br>&#x2022; Prior number of times worn: 12<br>&#x2022; Prior number of times worn on a Night 1: 2<br>&#x2022; Prior number of times worn on a Friday: 2<br><br>&#x2022; Last worn on a Night 2<br>&#x2022; Last worn on a Saturday,&#x2022; Shows since last worn: 9<br>&#x2022; Days since last worn: 33<br><br>&#x2022; Prior number of times worn: 11<br>&#x2022; Prior number of times worn on a Night 1: 1<br>&#x2022; Prior number of times worn on a Friday: 2<br><br>&#x2022; Last worn on a Night 3<br>&#x2022; Last worn on a Sunday,&#x2022; Wore at previous show<br>&#x2022; Days since last worn: 6<br><br>&#x2022; Prior number of times worn: 37<br>&#x2022; Prior number of times worn on a Night 1: 14<br>&#x2022; Prior number of times worn on a Friday: 14<br><br>&#x2022; Last worn on a Night 2<br>&#x2022; Last worn on a Saturday,&#x2022; Shows since last worn: 6<br>&#x2022; Days since last worn: 21<br><br>&#x2022; Prior number of times worn: 9<br>&#x2022; Prior number of times worn on a Night 1: 4<br>&#x2022; Prior number of times worn on a Friday: 4<br><br>&#x2022; Last worn on a Night 1<br>&#x2022; Last worn on a Friday,&#x2022; Wore at previous show<br>&#x2022; Days since last worn: 6<br><br>&#x2022; Prior number of times worn: 34<br>&#x2022; Prior number of times worn on a Night 1: 12<br>&#x2022; Prior number of times worn on a Friday: 12<br><br>&#x2022; Last worn on a Night 2<br>&#x2022; Last worn on a Saturday,First Time Worn,First Time Worn,&#x2022; Wore at previous show<br>&#x2022; Days since last worn: 6<br><br>&#x2022; Prior number of times worn: 39<br>&#x2022; Prior number of times worn on a Night 1: 15<br>&#x2022; Prior number of times worn on a Friday: 15<br><br>&#x2022; Last worn on a Night 2<br>&#x2022; Last worn on a Saturday,&#x2022; Shows since last worn: 4<br>&#x2022; Days since last worn: 14<br><br>&#x2022; Prior number of times worn: 9<br>&#x2022; Prior number of times worn on a Night 1: 2<br>&#x2022; Prior number of times worn on a Friday: 2<br><br>&#x2022; Last worn on a Night 1<br>&#x2022; Last worn on a Friday,&#x2022; Wore at previous show<br>&#x2022; Days since last worn: 6<br><br>&#x2022; Prior number of times worn: 11<br>&#x2022; Prior number of times worn on a Night 1: 4<br>&#x2022; Prior number of times worn on a Friday: 3<br><br>&#x2022; Last worn on a Night 2<br>&#x2022; Last worn on a Saturday,&#x2022; Wore at previous show<br>&#x2022; Days since last worn: 6<br><br>&#x2022; Prior number of times worn: 39<br>&#x2022; Prior number of times worn on a Night 1: 15<br>&#x2022; Prior number of times worn on a Friday: 15<br><br>&#x2022; Last worn on a Night 2<br>&#x2022; Last worn on a Saturday,&#x2022; Wore at previous show<br>&#x2022; Days since last worn: 6<br><br>&#x2022; Prior number of times worn: 39<br>&#x2022; Prior number of times worn on a Night 1: 15<br>&#x2022; Prior number of times worn on a Friday: 15<br><br>&#x2022; Last worn on a Night 2<br>&#x2022; Last worn on a Saturday,&#x2022; Wore at previous show<br>&#x2022; Days since last worn: 6<br><br>&#x2022; Prior number of times worn: 39<br>&#x2022; Prior number of times worn on a Night 1: 15<br>&#x2022; Prior number of times worn on a Friday: 15<br><br>&#x2022; Last worn on a Night 2<br>&#x2022; Last worn on a Saturday,&#x2022; Wore at previous show<br>&#x2022; Days since last worn: 6<br><br>&#x2022; Prior number of times worn: 39<br>&#x2022; Prior number of times worn on a Night 1: 15<br>&#x2022; Prior number of times worn on a Friday: 15<br><br>&#x2022; Last worn on a Night 2<br>&#x2022; Last worn on a Saturday,&#x2022; Wore at previous show<br>&#x2022; Days since last worn: 6<br><br>&#x2022; Prior number of times worn: 11<br>&#x2022; Prior number of times worn on a Night 1: 4<br>&#x2022; Prior number of times worn on a Friday: 3<br><br>&#x2022; Last worn on a Night 2<br>&#x2022; Last worn on a Saturday,First Time Worn,&#x2022; Shows since last worn: 2<br>&#x2022; Days since last worn: 7<br><br>&#x2022; Prior number of times worn: 20<br>&#x2022; Prior number of times worn on a Night 1: 8<br>&#x2022; Prior number of times worn on a Friday: 7<br><br>&#x2022; Last worn on a Night 1<br>&#x2022; Last worn on a Friday,&#x2022; Wore at previous show<br>&#x2022; Days since last worn: 6<br><br>&#x2022; Prior number of times worn: 18<br>&#x2022; Prior number of times worn on a Night 1: 9<br>&#x2022; Prior number of times worn on a Friday: 8<br><br>&#x2022; Last worn on a Night 2<br>&#x2022; Last worn on a Saturday
