concert_num,location,date,lover_bodysuit,lover_jacket,lover_guitar,fearless_dress,evermore,red_tshirt,red_guitar,speaknow,koi,reputation,folklore,1989_1,1989_2,ttpd_dress,ttpd_twopiece,ttpd_coverall,surprise_song,midnights_shirt,midnights_bodysuit,midnights_karmajacket,date_str,date_weekday,location_city,location_state_region,location_country,tour_leg,night_num,night_count,location_night,lover_bodysuit_n_since_last,lover_jacket_n_since_last,lover_guitar_n_since_last,fearless_dress_n_since_last,evermore_n_since_last,red_tshirt_n_since_last,red_guitar_n_since_last,speaknow_n_since_last,koi_n_since_last,reputation_n_since_last,folklore_n_since_last,1989_1_n_since_last,1989_2_n_since_last,ttpd_dress_n_since_last,ttpd_twopiece_n_since_last,ttpd_coverall_n_since_last,surprise_song_n_since_last,midnights_shirt_n_since_last,midnights_bodysuit_n_since_last,midnights_karmajacket_n_since_last
114,"Zurich, Switzerland",2024-07-10,Blue and Gold,Black,Blue,Black and Silver,0,WE ARE NEVER GETTING BACK TOGETHER.<br>LIKE EVER.,Black,Purple Layers,No,Red and Black,Blue Fairy,Purple,Yellow,I Love You,White,White/Gray,Raspberry,Iridescent,Chevron,Blue,"Wednesday, July 10, 2024",Wednesday,Zurich,,Switzerland,Europe,2,2,"Zurich, Switzerland<br>Night 2",&#x2022; Shows since last worn: 3<br>&#x2022; Days since last worn: 5<br><br>&#x2022; Prior number of times worn: 35<br>&#x2022; Prior number of times worn on a Night 2: 19<br>&#x2022; First time worn on a Wednesday<br><br>&#x2022; Last worn on a Night 2<br>&#x2022; Last worn on a Friday,&#x2022; Shows since last worn: 3<br>&#x2022; Days since last worn: 5<br><br>&#x2022; Prior number of times worn: 36<br>&#x2022; Prior number of times worn on a Night 2: 19<br>&#x2022; First time worn on a Wednesday<br><br>&#x2022; Last worn on a Night 2<br>&#x2022; Last worn on a Friday,&#x2022; Shows since last worn: 3<br>&#x2022; Days since last worn: 5<br><br>&#x2022; Prior number of times worn: 34<br>&#x2022; Prior number of times worn on a Night 2: 21<br>&#x2022; First time worn on a Wednesday<br><br>&#x2022; Last worn on a Night 2<br>&#x2022; Last worn on a Friday,&#x2022; Shows since last worn: 2<br>&#x2022; Days since last worn: 4<br><br>&#x2022; Prior number of times worn: 16<br>&#x2022; Prior number of times worn on a Night 2: 2<br>&#x2022; Prior number of times worn on a Wednesday: 1<br><br>&#x2022; Last worn on a Night 3<br>&#x2022; Last worn on a Saturday,&#x2022; Wore at previous show<br>&#x2022; Wore day before<br><br>&#x2022; Prior number of times worn: 30<br>&#x2022; Prior number of times worn on a Night 2: 10<br>&#x2022; Prior number of times worn on a Wednesday: 1<br><br>&#x2022; Last worn on a Night 1<br>&#x2022; Last worn on a Tuesday,&#x2022; Shows since last worn: 8<br>&#x2022; Days since last worn: 17<br><br>&#x2022; Prior number of times worn: 24<br>&#x2022; Prior number of times worn on a Night 2: 1<br>&#x2022; Prior number of times worn on a Wednesday: 1<br><br>&#x2022; Last worn on a Night 3<br>&#x2022; Last worn on a Sunday,&#x2022; Wore at previous show<br>&#x2022; Wore day before<br><br>&#x2022; Prior number of times worn: 108<br>&#x2022; Prior number of times worn on a Night 2: 36<br>&#x2022; Prior number of times worn on a Wednesday: 3<br><br>&#x2022; Last worn on a Night 1<br>&#x2022; Last worn on a Tuesday,&#x2022; Shows since last worn: 4<br>&#x2022; Days since last worn: 6<br><br>&#x2022; Prior number of times worn: 25<br>&#x2022; Prior number of times worn on a Night 2: 7<br>&#x2022; Prior number of times worn on a Wednesday: 1<br><br>&#x2022; Last worn on a Night 1<br>&#x2022; Last worn on a Thursday,&#x2022; Wore at previous show<br>&#x2022; Wore day before<br><br>&#x2022; Prior number of times worn: 69<br>&#x2022; Prior number of times worn on a Night 2: 25<br>&#x2022; Prior number of times worn on a Wednesday: 1<br><br>&#x2022; Last worn on a Night 1<br>&#x2022; Last worn on a Tuesday,&#x2022; Wore at previous show<br>&#x2022; Wore day before<br><br>&#x2022; Prior number of times worn: 113<br>&#x2022; Prior number of times worn on a Night 2: 38<br>&#x2022; Prior number of times worn on a Wednesday: 3<br><br>&#x2022; Last worn on a Night 1<br>&#x2022; Last worn on a Tuesday,&#x2022; Shows since last worn: 13<br>&#x2022; Days since last worn: 26<br><br>&#x2022; Prior number of times worn: 10<br>&#x2022; Prior number of times worn on a Night 2: 4<br>&#x2022; Prior number of times worn on a Wednesday: 2<br><br>&#x2022; Last worn on a Night 2<br>&#x2022; Last worn on a Friday,&#x2022; Shows since last worn: 9<br>&#x2022; Days since last worn: 18<br><br>&#x2022; Prior number of times worn: 4<br>&#x2022; Prior number of times worn on a Night 2: 2<br>&#x2022; First time worn on a Wednesday<br><br>&#x2022; Last worn on a Night 2<br>&#x2022; Last worn on a Saturday,&#x2022; Shows since last worn: 21<br>&#x2022; Days since last worn: 42<br><br>&#x2022; Prior number of times worn: 3<br>&#x2022; Prior number of times worn on a Night 2: 1<br>&#x2022; Prior number of times worn on a Wednesday: 1<br><br>&#x2022; Last worn on a Night 1<br>&#x2022; Last worn on a Wednesday,&#x2022; Wore at previous show<br>&#x2022; Wore day before<br><br>&#x2022; Prior number of times worn: 30<br>&#x2022; Prior number of times worn on a Night 2: 10<br>&#x2022; Prior number of times worn on a Wednesday: 1<br><br>&#x2022; Last worn on a Night 1<br>&#x2022; Last worn on a Tuesday,&#x2022; Shows since last worn: 3<br>&#x2022; Days since last worn: 5<br><br>&#x2022; Prior number of times worn: 11<br>&#x2022; Prior number of times worn on a Night 2: 5<br>&#x2022; First time worn on a Wednesday<br><br>&#x2022; Last worn on a Night 2<br>&#x2022; Last worn on a Friday,&#x2022; Shows since last worn: 3<br>&#x2022; Days since last worn: 5<br><br>&#x2022; Prior number of times worn: 7<br>&#x2022; Prior number of times worn on a Night 2: 4<br>&#x2022; First time worn on a Wednesday<br><br>&#x2022; Last worn on a Night 2<br>&#x2022; Last worn on a Friday,&#x2022; Shows since last worn: 2<br>&#x2022; Days since last worn: 4<br><br>&#x2022; Prior number of times worn: 9<br>&#x2022; Prior number of times worn on a Night 2: 2<br>&#x2022; First time worn on a Wednesday<br><br>&#x2022; Last worn on a Night 3<br>&#x2022; Last worn on a Saturday,&#x2022; Shows since last worn: 8<br>&#x2022; Days since last worn: 17<br><br>&#x2022; Prior number of times worn: 23<br>&#x2022; Prior number of times worn on a Night 2: 7<br>&#x2022; Prior number of times worn on a Wednesday: 1<br><br>&#x2022; Last worn on a Night 3<br>&#x2022; Last worn on a Sunday,&#x2022; Wore at previous show<br>&#x2022; Wore day before<br><br>&#x2022; Prior number of times worn: 20<br>&#x2022; Prior number of times worn on a Night 2: 3<br>&#x2022; Prior number of times worn on a Wednesday: 1<br><br>&#x2022; Last worn on a Night 1<br>&#x2022; Last worn on a Tuesday,&#x2022; Shows since last worn: 3<br>&#x2022; Days since last worn: 5<br><br>&#x2022; Prior number of times worn: 32<br>&#x2022; Prior number of times worn on a Night 2: 7<br>&#x2022; Prior number of times worn on a Wednesday: 3<br><br>&#x2022; Last worn on a Night 2<br>&#x2022; Last worn on a Friday
115,"Milan, Italy",2024-07-13,Pink and Blue,Silver,Pink,Tiger Stripes,0,I BET YOU THINK ABOUT ME,Black,Squiggles,No,Red and Black,Red Leaves,Blue,Blue,You Should Be,White,White/Gray,Orange,Silver Sequin,Chevron,Magenta,"Saturday, July 13, 2024",Saturday,Milan,,Italy,Europe,1,2,"Milan, Italy<br>Night 1",&#x2022; Shows since last worn: 5<br>&#x2022; Days since last worn: 9<br><br>&#x2022; Prior number of times worn: 46<br>&#x2022; Prior number of times worn on a Night 1: 24<br>&#x2022; Prior number of times worn on a Saturday: 13<br><br>&#x2022; Last worn on a Night 1<br>&#x2022; Last worn on a Thursday,&#x2022; Shows since last worn: 5<br>&#x2022; Days since last worn: 9<br><br>&#x2022; Prior number of times worn: 49<br>&#x2022; Prior number of times worn on a Night 1: 25<br>&#x2022; Prior number of times worn on a Saturday: 15<br><br>&#x2022; Last worn on a Night 1<br>&#x2022; Last worn on a Thursday,&#x2022; Shows since last worn: 3<br>&#x2022; Days since last worn: 7<br><br>&#x2022; Prior number of times worn: 52<br>&#x2022; Prior number of times worn on a Night 1: 29<br>&#x2022; Prior number of times worn on a Saturday: 13<br><br>&#x2022; Last worn on a Night 3<br>&#x2022; Last worn on a Saturday,First Time Worn,&#x2022; Wore at previous show<br>&#x2022; Days since last worn: 3<br><br>&#x2022; Prior number of times worn: 31<br>&#x2022; Prior number of times worn on a Night 1: 12<br>&#x2022; Prior number of times worn on a Saturday: 8<br><br>&#x2022; Last worn on a Night 2<br>&#x2022; Last worn on a Wednesday,&#x2022; Shows since last worn: 8<br>&#x2022; Days since last worn: 15<br><br>&#x2022; Prior number of times worn: 5<br>&#x2022; Prior number of times worn on a Night 1: 2<br>&#x2022; Prior number of times worn on a Saturday: 1<br><br>&#x2022; Last worn on a Night 1<br>&#x2022; Last worn on a Friday,&#x2022; Wore at previous show<br>&#x2022; Days since last worn: 3<br><br>&#x2022; Prior number of times worn: 109<br>&#x2022; Prior number of times worn on a Night 1: 37<br>&#x2022; Prior number of times worn on a Saturday: 34<br><br>&#x2022; Last worn on a Night 2<br>&#x2022; Last worn on a Wednesday,&#x2022; Shows since last worn: 4<br>&#x2022; Days since last worn: 8<br><br>&#x2022; Prior number of times worn: 10<br>&#x2022; Prior number of times worn on a Night 1: 3<br>&#x2022; Prior number of times worn on a Saturday: 4<br><br>&#x2022; Last worn on a Night 2<br>&#x2022; Last worn on a Friday,&#x2022; Wore at previous show<br>&#x2022; Days since last worn: 3<br><br>&#x2022; Prior number of times worn: 70<br>&#x2022; Prior number of times worn on a Night 1: 27<br>&#x2022; Prior number of times worn on a Saturday: 23<br><br>&#x2022; Last worn on a Night 2<br>&#x2022; Last worn on a Wednesday,&#x2022; Wore at previous show<br>&#x2022; Days since last worn: 3<br><br>&#x2022; Prior number of times worn: 114<br>&#x2022; Prior number of times worn on a Night 1: 40<br>&#x2022; Prior number of times worn on a Saturday: 36<br><br>&#x2022; Last worn on a Night 2<br>&#x2022; Last worn on a Wednesday,&#x2022; Shows since last worn: 2<br>&#x2022; Days since last worn: 4<br><br>&#x2022; Prior number of times worn: 11<br>&#x2022; Prior number of times worn on a Night 1: 3<br>&#x2022; Prior number of times worn on a Saturday: 3<br><br>&#x2022; Last worn on a Night 1<br>&#x2022; Last worn on a Tuesday,&#x2022; Shows since last worn: 2<br>&#x2022; Days since last worn: 4<br><br>&#x2022; Prior number of times worn: 5<br>&#x2022; Prior number of times worn on a Night 1: 3<br>&#x2022; Prior number of times worn on a Saturday: 1<br><br>&#x2022; Last worn on a Night 1<br>&#x2022; Last worn on a Tuesday,&#x2022; Shows since last worn: 11<br>&#x2022; Days since last worn: 22<br><br>&#x2022; Prior number of times worn: 5<br>&#x2022; Prior number of times worn on a Night 1: 4<br>&#x2022; First time worn on a Saturday<br><br>&#x2022; Last worn on a Night 1<br>&#x2022; Last worn on a Friday,First Time Worn,&#x2022; Wore at previous show<br>&#x2022; Days since last worn: 3<br><br>&#x2022; Prior number of times worn: 12<br>&#x2022; Prior number of times worn on a Night 1: 3<br>&#x2022; Prior number of times worn on a Saturday: 2<br><br>&#x2022; Last worn on a Night 2<br>&#x2022; Last worn on a Wednesday,&#x2022; Wore at previous show<br>&#x2022; Days since last worn: 3<br><br>&#x2022; Prior number of times worn: 8<br>&#x2022; Prior number of times worn on a Night 1: 2<br>&#x2022; Prior number of times worn on a Saturday: 2<br><br>&#x2022; Last worn on a Night 2<br>&#x2022; Last worn on a Wednesday,&#x2022; Shows since last worn: 2<br>&#x2022; Days since last worn: 4<br><br>&#x2022; Prior number of times worn: 12<br>&#x2022; Prior number of times worn on a Night 1: 6<br>&#x2022; Prior number of times worn on a Saturday: 4<br><br>&#x2022; Last worn on a Night 1<br>&#x2022; Last worn on a Tuesday,&#x2022; Shows since last worn: 5<br>&#x2022; Days since last worn: 9<br><br>&#x2022; Prior number of times worn: 26<br>&#x2022; Prior number of times worn on a Night 1: 7<br>&#x2022; Prior number of times worn on a Saturday: 9<br><br>&#x2022; Last worn on a Night 1<br>&#x2022; Last worn on a Thursday,&#x2022; Wore at previous show<br>&#x2022; Days since last worn: 3<br><br>&#x2022; Prior number of times worn: 21<br>&#x2022; Prior number of times worn on a Night 1: 11<br>&#x2022; Prior number of times worn on a Saturday: 4<br><br>&#x2022; Last worn on a Night 2<br>&#x2022; Last worn on a Wednesday,&#x2022; Shows since last worn: 2<br>&#x2022; Days since last worn: 4<br><br>&#x2022; Prior number of times worn: 38<br>&#x2022; Prior number of times worn on a Night 1: 13<br>&#x2022; Prior number of times worn on a Saturday: 17<br><br>&#x2022; Last worn on a Night 1<br>&#x2022; Last worn on a Tuesday
116,"Milan, Italy",2024-07-14,Orange and Pink,Orange,Pink,Fringe,0,THIS IS NOT TAYLOR'S VERSION,Black,Lilac Sparks,No,Red and Black,Green Leaves,Pink,Pink,You Should Be,Gray,Gray,Blueberry,Orchid,Chevron,Blue,"Sunday, July 14, 2024",Sunday,Milan,,Italy,Europe,2,2,"Milan, Italy<br>Night 2",&#x2022; Shows since last worn: 4<br>&#x2022; Days since last worn: 8<br><br>&#x2022; Prior number of times worn: 7<br>&#x2022; Prior number of times worn on a Night 2: 3<br>&#x2022; Prior number of times worn on a Sunday: 2<br><br>&#x2022; Last worn on a Night 3<br>&#x2022; Last worn on a Saturday,&#x2022; Shows since last worn: 4<br>&#x2022; Days since last worn: 8<br><br>&#x2022; Prior number of times worn: 7<br>&#x2022; Prior number of times worn on a Night 2: 3<br>&#x2022; Prior number of times worn on a Sunday: 2<br><br>&#x2022; Last worn on a Night 3<br>&#x2022; Last worn on a Saturday,&#x2022; Wore at previous show<br>&#x2022; Wore day before<br><br>&#x2022; Prior number of times worn: 53<br>&#x2022; Prior number of times worn on a Night 2: 10<br>&#x2022; Prior number of times worn on a Sunday: 7<br><br>&#x2022; Last worn on a Night 1<br>&#x2022; Last worn on a Saturday,&#x2022; Shows since last worn: 3<br>&#x2022; Days since last worn: 5<br><br>&#x2022; Prior number of times worn: 50<br>&#x2022; Prior number of times worn on a Night 2: 15<br>&#x2022; Prior number of times worn on a Sunday: 12<br><br>&#x2022; Last worn on a Night 1<br>&#x2022; Last worn on a Tuesday,&#x2022; Wore at previous show<br>&#x2022; Wore day before<br><br>&#x2022; Prior number of times worn: 32<br>&#x2022; Prior number of times worn on a Night 2: 11<br>&#x2022; Prior number of times worn on a Sunday: 6<br><br>&#x2022; Last worn on a Night 1<br>&#x2022; Last worn on a Saturday,&#x2022; Shows since last worn: 5<br>&#x2022; Days since last worn: 9<br><br>&#x2022; Prior number of times worn: 5<br>&#x2022; Prior number of times worn on a Night 2: 3<br>&#x2022; First time worn on a Sunday<br><br>&#x2022; Last worn on a Night 2<br>&#x2022; Last worn on a Friday,&#x2022; Wore at previous show<br>&#x2022; Wore day before<br><br>&#x2022; Prior number of times worn: 110<br>&#x2022; Prior number of times worn on a Night 2: 37<br>&#x2022; Prior number of times worn on a Sunday: 22<br><br>&#x2022; Last worn on a Night 1<br>&#x2022; Last worn on a Saturday,First Time Worn,&#x2022; Wore at previous show<br>&#x2022; Wore day before<br><br>&#x2022; Prior number of times worn: 71<br>&#x2022; Prior number of times worn on a Night 2: 26<br>&#x2022; Prior number of times worn on a Sunday: 14<br><br>&#x2022; Last worn on a Night 1<br>&#x2022; Last worn on a Saturday,&#x2022; Wore at previous show<br>&#x2022; Wore day before<br><br>&#x2022; Prior number of times worn: 115<br>&#x2022; Prior number of times worn on a Night 2: 39<br>&#x2022; Prior number of times worn on a Sunday: 22<br><br>&#x2022; Last worn on a Night 1<br>&#x2022; Last worn on a Saturday,&#x2022; Shows since last worn: 4<br>&#x2022; Days since last worn: 8<br><br>&#x2022; Prior number of times worn: 23<br>&#x2022; Prior number of times worn on a Night 2: 7<br>&#x2022; Prior number of times worn on a Sunday: 4<br><br>&#x2022; Last worn on a Night 3<br>&#x2022; Last worn on a Saturday,&#x2022; Shows since last worn: 10<br>&#x2022; Days since last worn: 21<br><br>&#x2022; Prior number of times worn: 5<br>&#x2022; Prior number of times worn on a Night 2: 3<br>&#x2022; Prior number of times worn on a Sunday: 1<br><br>&#x2022; Last worn on a Night 3<br>&#x2022; Last worn on a Sunday,&#x2022; Shows since last worn: 4<br>&#x2022; Days since last worn: 8<br><br>&#x2022; Prior number of times worn: 5<br>&#x2022; Prior number of times worn on a Night 2: 1<br>&#x2022; First time worn on a Sunday<br><br>&#x2022; Last worn on a Night 3<br>&#x2022; Last worn on a Saturday,&#x2022; Wore at previous show<br>&#x2022; Wore day before<br><br>&#x2022; Prior number of times worn: 1<br>&#x2022; First time worn on a Night 2<br>&#x2022; First time worn on a Sunday<br><br>&#x2022; Last worn on a Night 1<br>&#x2022; Last worn on a Saturday,&#x2022; Shows since last worn: 6<br>&#x2022; Days since last worn: 10<br><br>&#x2022; Prior number of times worn: 8<br>&#x2022; Prior number of times worn on a Night 2: 1<br>&#x2022; Prior number of times worn on a Sunday: 2<br><br>&#x2022; Last worn on a Night 1<br>&#x2022; Last worn on a Thursday,&#x2022; Shows since last worn: 3<br>&#x2022; Days since last worn: 5<br><br>&#x2022; Prior number of times worn: 9<br>&#x2022; Prior number of times worn on a Night 2: 1<br>&#x2022; Prior number of times worn on a Sunday: 2<br><br>&#x2022; Last worn on a Night 1<br>&#x2022; Last worn on a Tuesday,&#x2022; Shows since last worn: 5<br>&#x2022; Days since last worn: 9<br><br>&#x2022; Prior number of times worn: 9<br>&#x2022; Prior number of times worn on a Night 2: 5<br>&#x2022; Prior number of times worn on a Sunday: 2<br><br>&#x2022; Last worn on a Night 2<br>&#x2022; Last worn on a Friday,&#x2022; Shows since last worn: 4<br>&#x2022; Days since last worn: 8<br><br>&#x2022; Prior number of times worn: 17<br>&#x2022; Prior number of times worn on a Night 2: 3<br>&#x2022; Prior number of times worn on a Sunday: 1<br><br>&#x2022; Last worn on a Night 3<br>&#x2022; Last worn on a Saturday,&#x2022; Wore at previous show<br>&#x2022; Wore day before<br><br>&#x2022; Prior number of times worn: 22<br>&#x2022; Prior number of times worn on a Night 2: 4<br>&#x2022; Prior number of times worn on a Sunday: 5<br><br>&#x2022; Last worn on a Night 1<br>&#x2022; Last worn on a Saturday,&#x2022; Shows since last worn: 2<br>&#x2022; Days since last worn: 4<br><br>&#x2022; Prior number of times worn: 33<br>&#x2022; Prior number of times worn on a Night 2: 8<br>&#x2022; Prior number of times worn on a Sunday: 6<br><br>&#x2022; Last worn on a Night 2<br>&#x2022; Last worn on a Wednesday
117,"Gelsenkirchen, Germany",2024-07-17,Barbie Pink,Pink,Pink,Fringe,0,WHO'S TAYLOR SWIFT ANYWAY? EW.,Black,Champagne,No,Red and Black,Cream,Yellow,Yellow,You Should Be,Gray,Gray,Orange,Iridescent,Cutouts,Multicolor,"Wednesday, July 17, 2024",Wednesday,Gelsenkirchen,,Germany,Europe,1,3,"Gelsenkirchen, Germany<br>Night 1",&#x2022; Shows since last worn: 10<br>&#x2022; Days since last worn: 19<br><br>&#x2022; Prior number of times worn: 10<br>&#x2022; Prior number of times worn on a Night 1: 4<br>&#x2022; First time worn on a Wednesday<br><br>&#x2022; Last worn on a Night 1<br>&#x2022; Last worn on a Friday,&#x2022; Shows since last worn: 10<br>&#x2022; Days since last worn: 19<br><br>&#x2022; Prior number of times worn: 10<br>&#x2022; Prior number of times worn on a Night 1: 4<br>&#x2022; First time worn on a Wednesday<br><br>&#x2022; Last worn on a Night 1<br>&#x2022; Last worn on a Friday,&#x2022; Wore at previous show<br>&#x2022; Days since last worn: 3<br><br>&#x2022; Prior number of times worn: 54<br>&#x2022; Prior number of times worn on a Night 1: 30<br>&#x2022; Prior number of times worn on a Wednesday: 3<br><br>&#x2022; Last worn on a Night 2<br>&#x2022; Last worn on a Sunday,&#x2022; Wore at previous show<br>&#x2022; Days since last worn: 3<br><br>&#x2022; Prior number of times worn: 51<br>&#x2022; Prior number of times worn on a Night 1: 21<br>&#x2022; Prior number of times worn on a Wednesday: 2<br><br>&#x2022; Last worn on a Night 2<br>&#x2022; Last worn on a Sunday,&#x2022; Wore at previous show<br>&#x2022; Days since last worn: 3<br><br>&#x2022; Prior number of times worn: 33<br>&#x2022; Prior number of times worn on a Night 1: 13<br>&#x2022; Prior number of times worn on a Wednesday: 2<br><br>&#x2022; Last worn on a Night 2<br>&#x2022; Last worn on a Sunday,&#x2022; Shows since last worn: 4<br>&#x2022; Days since last worn: 8<br><br>&#x2022; Prior number of times worn: 34<br>&#x2022; Prior number of times worn on a Night 1: 12<br>&#x2022; Prior number of times worn on a Wednesday: 1<br><br>&#x2022; Last worn on a Night 1<br>&#x2022; Last worn on a Tuesday,&#x2022; Wore at previous show<br>&#x2022; Days since last worn: 3<br><br>&#x2022; Prior number of times worn: 111<br>&#x2022; Prior number of times worn on a Night 1: 38<br>&#x2022; Prior number of times worn on a Wednesday: 4<br><br>&#x2022; Last worn on a Night 2<br>&#x2022; Last worn on a Sunday,&#x2022; Shows since last worn: 4<br>&#x2022; Days since last worn: 8<br><br>&#x2022; Prior number of times worn: 35<br>&#x2022; Prior number of times worn on a Night 1: 16<br>&#x2022; First time worn on a Wednesday<br><br>&#x2022; Last worn on a Night 1<br>&#x2022; Last worn on a Tuesday,&#x2022; Wore at previous show<br>&#x2022; Days since last worn: 3<br><br>&#x2022; Prior number of times worn: 72<br>&#x2022; Prior number of times worn on a Night 1: 28<br>&#x2022; Prior number of times worn on a Wednesday: 2<br><br>&#x2022; Last worn on a Night 2<br>&#x2022; Last worn on a Sunday,&#x2022; Wore at previous show<br>&#x2022; Days since last worn: 3<br><br>&#x2022; Prior number of times worn: 116<br>&#x2022; Prior number of times worn on a Night 1: 41<br>&#x2022; Prior number of times worn on a Wednesday: 4<br><br>&#x2022; Last worn on a Night 2<br>&#x2022; Last worn on a Sunday,&#x2022; Shows since last worn: 9<br>&#x2022; Days since last worn: 18<br><br>&#x2022; Prior number of times worn: 34<br>&#x2022; Prior number of times worn on a Night 1: 14<br>&#x2022; Prior number of times worn on a Wednesday: 1<br><br>&#x2022; Last worn on a Night 2<br>&#x2022; Last worn on a Saturday,&#x2022; Shows since last worn: 9<br>&#x2022; Days since last worn: 18<br><br>&#x2022; Prior number of times worn: 5<br>&#x2022; Prior number of times worn on a Night 1: 2<br>&#x2022; First time worn on a Wednesday<br><br>&#x2022; Last worn on a Night 2<br>&#x2022; Last worn on a Saturday,&#x2022; Shows since last worn: 3<br>&#x2022; Days since last worn: 7<br><br>&#x2022; Prior number of times worn: 4<br>&#x2022; Prior number of times worn on a Night 1: 1<br>&#x2022; Prior number of times worn on a Wednesday: 2<br><br>&#x2022; Last worn on a Night 2<br>&#x2022; Last worn on a Wednesday,&#x2022; Wore at previous show<br>&#x2022; Days since last worn: 3<br><br>&#x2022; Prior number of times worn: 2<br>&#x2022; Prior number of times worn on a Night 1: 1<br>&#x2022; First time worn on a Wednesday<br><br>&#x2022; Last worn on a Night 2<br>&#x2022; Last worn on a Sunday,&#x2022; Wore at previous show<br>&#x2022; Days since last worn: 3<br><br>&#x2022; Prior number of times worn: 9<br>&#x2022; Prior number of times worn on a Night 1: 4<br>&#x2022; First time worn on a Wednesday<br><br>&#x2022; Last worn on a Night 2<br>&#x2022; Last worn on a Sunday,&#x2022; Wore at previous show<br>&#x2022; Days since last worn: 3<br><br>&#x2022; Prior number of times worn: 10<br>&#x2022; Prior number of times worn on a Night 1: 5<br>&#x2022; First time worn on a Wednesday<br><br>&#x2022; Last worn on a Night 2<br>&#x2022; Last worn on a Sunday,&#x2022; Shows since last worn: 2<br>&#x2022; Days since last worn: 4<br><br>&#x2022; Prior number of times worn: 13<br>&#x2022; Prior number of times worn on a Night 1: 7<br>&#x2022; Prior number of times worn on a Wednesday: 1<br><br>&#x2022; Last worn on a Night 1<br>&#x2022; Last worn on a Saturday,&#x2022; Shows since last worn: 3<br>&#x2022; Days since last worn: 7<br><br>&#x2022; Prior number of times worn: 24<br>&#x2022; Prior number of times worn on a Night 1: 11<br>&#x2022; Prior number of times worn on a Wednesday: 2<br><br>&#x2022; Last worn on a Night 2<br>&#x2022; Last worn on a Wednesday,&#x2022; Shows since last worn: 18<br>&#x2022; Days since last worn: 38<br><br>&#x2022; Prior number of times worn: 25<br>&#x2022; Prior number of times worn on a Night 1: 5<br>&#x2022; Prior number of times worn on a Wednesday: 1<br><br>&#x2022; Last worn on a Night 3<br>&#x2022; Last worn on a Sunday,&#x2022; Shows since last worn: 7<br>&#x2022; Days since last worn: 13<br><br>&#x2022; Prior number of times worn: 35<br>&#x2022; Prior number of times worn on a Night 1: 15<br>&#x2022; First time worn on a Wednesday<br><br>&#x2022; Last worn on a Night 1<br>&#x2022; Last worn on a Thursday
